{
  "$schema": "https://json-schema.org/draft/2020-12/schema",
  "$id": "https://github.com/mixproto/mixcore/contracts/core-api/v0/state.schema.json",
  "title": "mixcore core API v0.1: StateListener.OnState(stateJSON)",
  "description": "A snapshot replaces everything the UI holds; a diff lists changes since the previous message. seq grows by one per message; a gap never happens within one Start. Values are the console's, never the UI's. events report holds that ended without the user releasing them; they appear in snapshots and diffs and are never dropped by coalescing (up to 256 between two messages).",
  "type": "object",
  "additionalProperties": false,
  "required": [
    "version",
    "type",
    "seq",
    "status"
  ],
  "properties": {
    "version": {
      "$ref": "common.schema.json#/$defs/version"
    },
    "type": {
      "enum": [
        "snapshot",
        "diff"
      ]
    },
    "seq": {
      "type": "integer",
      "minimum": 1
    },
    "status": {
      "enum": [
        "stopped",
        "connecting",
        "live",
        "stale"
      ],
      "description": "live: input unlocked. stale: connection lost (no packet from the console for 1.5 s, or the console stopped answering), last values shown, Apply returns ERR_STALE. connecting: not yet connected since Start/Resume. stopped: Stop or Pause. status, reason, staleSinceMs, offline (and the v0.1 connection fields below) describe the connection in every message, snapshot or diff; an absent optional field means false or none."
    },
    "reason": {
      "type": "string",
      "description": "Diagnostic text for logs, never shown to users as is."
    },
    "staleSinceMs": {
      "type": "integer",
      "description": "v0.1. Present only while status is stale: when the connection was lost, as Unix time in milliseconds (wall clock of this device). The UI counts up from it ('Reconnecting 0:07'). It does not move while reconnect attempts fail; it disappears when the status leaves stale."
    },
    "limited": {
      "type": "boolean",
      "description": "v0.1. True while the console accepts this engine but does not send it updates because its remote client slots are full (design SR-17, CR-10; x32: four push clients). Values may be stale and are shown as such; Apply returns ERR_STALE and every hold is cancelled (holdCancelled, reason limited) although status stays live. It clears by itself as soon as an update arrives; a Pause and Resume retries. There is no polling fallback (CR-15 is unverified). Absent means false."
    },
    "limitedReason": {
      "enum": [
        "noEchoOfOwnWrites",
        "rereadFoundUnpushedChanges"
      ],
      "description": "v0.1. Present with limited: the evidence. noEchoOfOwnWrites: three writes that changed a value got no confirmation while the console answered. rereadFoundUnpushedChanges: two background re-reads in a row found values that changed without an update."
    },
    "offline": {
      "type": "boolean",
      "description": "v0.1. True once status has been stale for 30 s (design 8.1 'Offline', a stronger label only: the core keeps retrying at the same pace). Absent means false."
    },
    "console": {
      "type": "object",
      "additionalProperties": false,
      "properties": {
        "address": {
          "type": "string"
        },
        "name": {
          "type": "string"
        },
        "model": {
          "type": "string"
        },
        "firmware": {
          "type": "string"
        }
      }
    },
    "strips": {
      "type": "array",
      "description": "snapshot only: inputs in order, then main.",
      "items": {
        "type": "object",
        "additionalProperties": false,
        "required": [
          "kind",
          "faderDB",
          "mute",
          "name"
        ],
        "properties": {
          "kind": {
            "enum": [
              "input",
              "main"
            ]
          },
          "index": {
            "type": "integer",
            "minimum": 1
          },
          "name": {
            "type": "string"
          },
          "faderDB": {
            "$ref": "common.schema.json#/$defs/level"
          },
          "mute": {
            "type": "boolean"
          },
          "muteGroups": {
            "$ref": "common.schema.json#/$defs/groupList",
            "description": "v0.1: mute groups this strip belongs to."
          },
          "dcas": {
            "$ref": "common.schema.json#/$defs/groupList",
            "description": "v0.1: DCA groups this strip belongs to (inputs only on x32)."
          },
          "effectiveMute": {
            "$ref": "common.schema.json#/$defs/effectiveMute"
          }
        }
      }
    },
    "changes": {
      "type": "array",
      "description": "diff only; present (possibly empty) in every diff. v0.1: when a mute, a group state or a membership changes, the core also lists every strip whose effectiveMute changed, as field effectiveMute with the origin of the change that caused it.",
      "items": {
        "type": "object",
        "additionalProperties": false,
        "required": [
          "param",
          "value",
          "origin"
        ],
        "properties": {
          "param": {
            "$ref": "common.schema.json#/$defs/param"
          },
          "value": {
            "$ref": "common.schema.json#/$defs/value"
          },
          "origin": {
            "$ref": "common.schema.json#/$defs/origin"
          }
        }
      }
    },
    "events": {
      "type": "array",
      "items": {
        "oneOf": [
          {
            "type": "object",
            "additionalProperties": false,
            "required": [
              "type",
              "param",
              "clientId",
              "value",
              "origin"
            ],
            "description": "The desk, a scene recall or another client changed a parameter this client was holding. The console's value is already in state (in changes, or in the snapshot). The gesture has ended: Apply for this param from this client returns ERR_GESTURE_ENDED until a new holdBegin (or holdEnd). Suggested UI text: 'Changed at the mixer: -10.0 dB'.",
            "properties": {
              "type": {
                "const": "externalChangeOnHeld"
              },
              "param": {
                "$ref": "common.schema.json#/$defs/param"
              },
              "clientId": {
                "type": "string"
              },
              "value": {
                "$ref": "common.schema.json#/$defs/value"
              },
              "origin": {
                "$ref": "common.schema.json#/$defs/origin"
              }
            }
          },
          {
            "type": "object",
            "additionalProperties": false,
            "required": [
              "type",
              "param",
              "clientId",
              "reason"
            ],
            "description": "The hold was cancelled because the console went stale, the engine was stopped/paused or (v0.1) the console stopped sending updates (limited). No write resumes when the status returns to live: the UI must send a new holdBegin.",
            "properties": {
              "type": {
                "const": "holdCancelled"
              },
              "param": {
                "$ref": "common.schema.json#/$defs/param"
              },
              "clientId": {
                "type": "string"
              },
              "reason": {
                "enum": [
                  "stale",
                  "stopped",
                  "limited"
                ],
                "description": "limited is v0.1."
              }
            }
          },
          {
            "type": "object",
            "additionalProperties": false,
            "required": [
              "type",
              "confidence",
              "signals"
            ],
            "description": "v0.1 (design SR-15, CR-03). The console has no scene-recall message (x32: X32-F60), so the core infers it: a burst of at least 8 different parameters pushed within 250 ms, and pushes of the console's scene markers if it sends them (/-undo/time, /-show/prepos/current; whether it does is unverified). Every held fader has ended (externalChangeOnHeld events in the same message) and the core re-reads the console in the background. Suggested UI text: 'Scene recalled at the mixer' (high or medium), or nothing beyond the per-fader messages (low).",
            "properties": {
              "type": {
                "const": "sceneRecalledAtConsole"
              },
              "confidence": {
                "enum": [
                  "high",
                  "medium",
                  "low"
                ],
                "description": "high: a burst and a scene marker; medium: a scene marker alone; low: a burst alone (another app changing many parameters at once looks the same)."
              },
              "signals": {
                "type": "array",
                "items": {
                  "enum": [
                    "burst",
                    "undoTime",
                    "highlightedScene"
                  ]
                },
                "uniqueItems": true
              },
              "highlightedScene": {
                "type": "integer",
                "description": "Present when the console pushed /-show/prepos/current: the scene (or cue/snippet, per the console's show-control setting) HIGHLIGHTED on its scenes page, not necessarily the one loaded (X32-F61). Show it as a hint only."
              }
            }
          }
        ]
      },
      "description": "Events report holds that ended without the user releasing them and (v0.1) scene recalls detected at the console. They appear in snapshots and diffs and are never dropped by coalescing (up to 256 between two messages)."
    },
    "muteGroups": {
      "type": "array",
      "items": {
        "type": "object",
        "additionalProperties": false,
        "required": [
          "index",
          "mute"
        ],
        "properties": {
          "index": {
            "type": "integer",
            "minimum": 1
          },
          "mute": {
            "type": "boolean"
          }
        }
      },
      "description": "v0.1, snapshot only: every mute group of the console; mute true = engaged. Changes arrive in diffs as param {strip: {kind: muteGroup, index}, field: mute}. Absent when the console has none (or did not answer for them)."
    },
    "dcas": {
      "type": "array",
      "items": {
        "type": "object",
        "additionalProperties": false,
        "required": [
          "index",
          "mute"
        ],
        "properties": {
          "index": {
            "type": "integer",
            "minimum": 1
          },
          "mute": {
            "type": "boolean"
          }
        }
      },
      "description": "v0.1, snapshot only: every DCA group; mute true = DCA muted."
    }
  },
  "allOf": [
    {
      "if": {
        "properties": {
          "type": {
            "const": "snapshot"
          }
        }
      },
      "then": {
        "required": [
          "strips"
        ]
      }
    },
    {
      "if": {
        "properties": {
          "type": {
            "const": "diff"
          }
        }
      },
      "then": {
        "required": [
          "changes"
        ]
      }
    }
  ]
}
