{"version":0,"type":"snapshot","seq":1,"status":"live","console":{"name":"FOH","model":"X32"},"strips":[{"kind":"input","index":1,"name":"Kick","faderDB":-3.5,"mute":false},{"kind":"main","name":"","faderDB":"-inf","mute":false}],"events":[{"type":"externalChangeOnHeld","param":{"strip":{"kind":"main"},"field":"fader"},"clientId":"ios-1","value":-6,"origin":{"kind":"console"}},{"type":"holdCancelled","param":{"strip":{"kind":"main"},"field":"fader"},"clientId":"ios-2","reason":"stale"}]}