{"version":0,"type":"diff","seq":2,"status":"live","changes":[{"param":{"strip":{"kind":"input","index":1},"field":"sendLevel","bus":2},"value":-6,"origin":{"kind":"gesture","clientId":"mon","seq":4}},{"param":{"strip":{"kind":"bus","index":2},"field":"colour"},"value":"green","origin":{"kind":"console"}},{"param":{"strip":{"kind":"bus","index":1},"field":"linked"},"value":false,"origin":{"kind":"console"}}]}